,Unnamed: 0.2,Unnamed: 0.1,Unnamed: 0,participant_id,Sentence ID,Iteration,probability,Expected Transcription,large,base,medium,small,tiny,preproc_exp_transc,large_preproc,base_preproc,medium_preproc,small_preproc,tiny_preproc,large_wer,base_wer,medium_wer,small_wer,tiny_wer
21806,37473,37473,37473,t14,75_3,L1,low prob,"To drive the car, daddy turns the hearts.",She drives the car that he turns to hearts.,Drive the car that it turns the heart.,Drive the car that it turns to heart.,Drive the car that it turns the heart.,Should I have the card that it turns the heart.,"to drive the car, daddy turns the hearts.",she drives the car that he turns to hearts.,drive the car that it turns the heart.,drive the car that it turns to heart.,drive the car that it turns the heart.,should i have the card that it turns the heart.,0.75,0.625,0.75,0.625,0.875
21837,37504,37504,37504,t14,32_1,L1,high prob,On her finger she wore a ring.,on her fingers she rolled.,Okay fingers fried.,on her fingers to roar.,I don't have fingers to roll.,I don't have fingers to roar.,on her finger she wore a ring.,on her fingers she rolled.,okay fingers fried.,on her fingers to roar.,i do not have fingers to roll.,i do not have fingers to roar.,0.5714285714285714,1.0,0.7142857142857143,1.0,1.0
21842,37509,37509,37509,t14,46_2,L1,low prob,"At Valentine's day, we drew lots of pants.",A Valentine's Day with lots of paint.,Evident time stay would be a lot of paint.,On Valentine's Day we drew lots of pants.,A Valentine's Day which read lots of pints.,If Valentine's Day would be lots of paint.,"at valentine is day, we drew lots of pants.",a valentine is day with lots of paint.,evident time stay would be a lot of paint.,on valentine is day we drew lots of pants.,a valentine is day which read lots of pints.,if valentine is day would be lots of paint.,0.5555555555555556,0.8888888888888888,0.2222222222222222,0.5555555555555556,0.5555555555555556
21856,37523,37523,37523,t14,48_1,L1,nonword,We moved our burniture on the back of a flower.,we moved our furniture on the back of the floor flower oh my god.,"Remove that burning tree on the back of the floor.
Flower oh my god.",we moved our burning tree on the back of the floor flower oh my god.,we moved our bird entry on the back of the floor flower oh my god.,"We moved out of Berry tree on the back of the floor.
Flower and only God.",we moved our burniture on the back of a flower.,we moved our furniture on the back of the floor flower oh my god.,remove that burning tree on the back of the floor. flower oh my god.,we moved our burning tree on the back of the floor flower oh my god.,we moved our bird entry on the back of the floor flower oh my god.,we moved out of berry tree on the back of the floor. flower and only god.,0.7,1.0,0.8,0.8,1.0
21859,37526,37526,37526,t14,72_2,L1,low prob,The boy has a toy choo-choo leaf.,The boy has a toy to cheer him up.,The boy has a toy to cheer me.,The boy has a toy choo-choo leaf.,The boy has a toy to cheer you up.,The boy has a toy to leave.,the boy has a toy choo-choo leaf.,the boy has a toy to cheer him up.,the boy has a toy to cheer me.,the boy has a toy choo-choo leaf.,the boy has a toy to cheer you up.,the boy has a toy to leave.,0.5714285714285714,0.4285714285714285,0.0,0.5714285714285714,0.2857142857142857
21864,37531,37531,37531,t14,3_3,L1,low prob,"The king wore a shiny, gold box",The King Worries Shiny Gold Bots.,The King Warrior Shining Gold Buds.,The King wore his shiny gold box.,The king wore his shiny gold box.,The King worries shiny gold bots.,"the king wore a shiny, gold box",the king worries shiny gold bots.,the king warrior shining gold buds.,the king wore his shiny gold box.,the king wore his shiny gold box.,the king worries shiny gold bots.,0.5714285714285714,0.5714285714285714,0.4285714285714285,0.4285714285714285,0.5714285714285714
21871,37538,37538,37538,t14,47_1,R4P1,nonword,"At brinner, my family sits together at the man.","In Burma, my family sits together as a man.
Brunner.
Don't be too fast.
Okay.
Okay.",a brimmer my family sister are the men brinner okay okay.,at Brimmer my family sits together at a man Brinner okay okay.,a brimmer my family sits together at the man brinner don't be too fast okay.,"A Bermer, my family sister, together, are the men.
Bermer.
Don't get too fast.
Okay.
Okay.","at brinner, my family sits together at the man.","in burma, my family sits together as a man. brunner. do not be too fast. okay. okay.",a brimmer my family sister are the men brinner okay okay.,at brimmer my family sits together at a man brinner okay okay.,a brimmer my family sits together at the man brinner do not be too fast okay.,"a bermer, my family sister, together, are the men. bermer. do not get too fast. okay. okay.",1.3333333333333333,1.0,0.6666666666666666,1.1111111111111112,1.5555555555555556
21887,37554,37554,37554,t14,34_2,L2,low prob,"At the zoo, I saw a tall key.",At the US of Turkey.,"Earth, we were so tired.",Add to the USO a tall key.,Let's do a little talkie.,"It did the U.
S.
-O-O-S.","at the zoo, i saw a tall key.",at the us of turkey.,"earth, we were so tired.",add to the uso a tall key.,let us do a little talkie.,it did the u. s. -o-o-s.,0.75,1.0,0.625,0.875,1.0
21888,37555,37555,37555,t14,37_1,L1,nonword,Dandma sits on her porch in a bat.,"Then let's say it's a porch and a bat.
Porch and a bat.","then let's just approach and the bat, portion of bat, okay.","Then let's say it's a porch and a bat.
Porch and a bat, okay.","Then let's approach the back.
Purchase the back.","then let's say it's her project and the back, portion the back, okay.",dandma sits on her porch in a bat.,then let us say it is a porch and a bat. porch and a bat.,"then let us just approach and the bat, portion of bat, okay.","then let us say it is a porch and a bat. porch and a bat, okay.",then let us approach the back. purchase the back.,"then let us say it is her project and the back, portion the back, okay.",1.5,1.5,1.625,1.125,1.75
21889,37556,37556,37556,t14,26_3,L1,low prob,The bee sat on the petals of the watch.,The B7 pedals of the watch.,The bees are in the petals of the watch.,The B7 pedals of the watch.,The B7 pedals of the watch.,The Peace and Petos of the Watch.,the bee sat on the petals of the watch.,the b7 pedals of the watch.,the bees are in the petals of the watch.,the b7 pedals of the watch.,the b7 pedals of the watch.,the peace and petos of the watch.,0.5555555555555556,0.3333333333333333,0.5555555555555556,0.5555555555555556,0.5555555555555556
21895,37562,37562,37562,t14,66_2,L2,nonword,"For sleckfast, Mommy poured me a bowl of butterfly.","First act, first mummy, pour me a bowl of butterfly.",for sex first mummy pour me a ball of butterfly.,For a sec first mummy poured me a ball of butterfly.,For that first mummy poured me a ball of butterfly.,"So, sex first mummy poured me a ball of butterfly.","for sleckfast, mommy poured me a bowl of butterfly.","first act, first mummy, pour me a bowl of butterfly.",for sex first mummy pour me a ball of butterfly.,for a sec first mummy poured me a ball of butterfly.,for that first mummy poured me a ball of butterfly.,"so, sex first mummy poured me a ball of butterfly.",0.5555555555555556,0.5555555555555556,0.5555555555555556,0.4444444444444444,0.5555555555555556
21898,37565,37565,37565,t14,99_2,R6P2,nonword,"To cross the sivver, we walked on a banana.",To cross the severely walking banana.,To cross the several you walked my banana.,to cross the severely walked-in banana.,To cross the civil you walk my banana.,to cross the civil you walked my banana.,"to cross the sivver, we walked on a banana.",to cross the severely walking banana.,to cross the several you walked my banana.,to cross the severely walked-in banana.,to cross the civil you walk my banana.,to cross the civil you walked my banana.,0.5555555555555556,0.4444444444444444,0.5555555555555556,0.5555555555555556,0.4444444444444444
21901,37568,37568,37568,t14,39_2,L1,low prob,The bunny nibbled a clown.,The bunny level account.,Dobbony Kub22.,the bunny little cow.,the money鉛子.,Bletime by Benster.,the bunny nibbled a clown.,the bunny level account.,dobbony kub22.,the bunny little cow.,the money鉛子.,bletime by benster.,0.6,1.0,0.6,0.8,1.0
21903,37570,37570,37570,t14,12_3,L1,nonword,The tockstar was playing his door.,The Toxtower is playing Histoire.,The Toxdower is playing his door.,The talk star was playing his tour.,The Toxtower is playing his store.,The talk star was playing his door.,the tockstar was playing his door.,the toxtower is playing histoire.,the toxdower is playing his door.,the talk star was playing his tour.,the toxtower is playing his store.,the talk star was playing his door.,0.6666666666666666,0.3333333333333333,0.5,0.5,0.3333333333333333
